{
  "id": "qi_xu",
  "name": "氣虛",
  "category": "病性",
  "subcategory": "氣機病變",
  "treatment": "補氣",
  "is_critical": false,
  "alias": ["氣弱", "中氣不足", "元氣虧虛"],
  "description": "氣虛是指人體元氣不足，臟腑功能活動減退的病理狀態。可發生於各個臟腑，表現為該臟腑功能低下的症狀。",
  "related_symptoms": ["symptom_fali", "symptom_qiduan", "symptom_zihanl"]
}
